{
  "phase": "inference",
  "model_name": "vit_base_patch16_224",
  "dataset_id": "imagenet_val",
  "image_count": 2000,
  "metrics": { "accuracy": 0.88, "precision": 0.85, "recall": 0.83, "f1_score": 0.84 },
  "latency_ms": 150.0,
  "batch_size": 32,
  "hardware": { "accelerator": "GPU", "memory_gb": 24 },
  "result": "success",
  "category": "cv",
  "meta": {
    "raw_message": "example v08",
    "parse": { "parser_name": "ulog-cv", "parser_version": "1.0.0", "pattern_id": "v08", "ok": true }
  }
}
