{
  "phase": "eval",
  "model_name": "deeplabv3_resnet101",
  "dataset_id": "cityscapes_eval",
  "image_count": 500,
  "metrics": { "f1_score": 0.78, "precision": 0.8, "recall": 0.77 },
  "latency_ms": 200.0,
  "batch_size": 8,
  "hardware": { "accelerator": "GPU", "memory_gb": 16 },
  "result": "success",
  "category": "cv",
  "meta": {
    "raw_message": "example v10",
    "parse": { "parser_name": "ulog-cv", "parser_version": "1.0.0", "pattern_id": "v10", "ok": true }
  }
}
