{
  "phase": "inference",
  "model_name": "vit_base",
  "dataset_id": "imagenet_val",
  "image_count": 5000,
  "metrics": { "accuracy": 0.81 },
  "latency_ms": 35.5,
  "batch_size": 32,
  "hardware": { "accelerator": "GPU", "memory_gb": 16 },
  "result": "success",
  "category": "cv",
  "meta": {
    "raw_message": "example v05",
    "parse": { "parser_name": "ulog-cv", "parser_version": "1.0.0", "pattern_id": "v05", "ok": true }
  }
}
