{
  "phase": "inference",
  "model_name": "resnet50_v2",
  "dataset_id": "imagenet_v2",
  "image_count": 1280000,
  "metrics": { "accuracy": 0.76, "loss": 0.84 },
  "latency_ms": 150.2,
  "batch_size": 64,
  "hardware": { "accelerator": "GPU", "memory_gb": 24 },
  "result": "success",
  "category": "cv",
  "meta": {
    "raw_message": "example v01",
    "parse": { "parser_name": "ulog-cv", "parser_version": "1.0.0", "pattern_id": "v01", "ok": true }
  },
  "timestamp": "2025-10-04T09:00:00Z"
}
