{
  "phase": "eval",
  "model_name": "deeplabv3",
  "dataset_id": "cityscapes_eval",
  "image_count": 500,
  "metrics": { "map": 0.78, "accuracy": 0.83 },
  "latency_ms": 120.0,
  "batch_size": 8,
  "hardware": { "accelerator": "GPU", "memory_gb": 24 },
  "result": "success",
  "category": "cv",
  "meta": {
    "raw_message": "example v09",
    "parse": { "parser_name": "ulog-cv", "parser_version": "1.0.0", "pattern_id": "v09", "ok": true }
  }
}
